review_id,user_id,business_id,stars,useful,funny,cool,text,date
hzXSzv6g20CkT3pY5cYWYw,OrUBEKwIQqnz1wUX99ZwrA,bjhCtlYHrkgA5Ku8l-rB3g,5,0,0,0,Love the muffins at ODB- and the staff! Jose knows how to do the best Christmas lattes!,2015/12/17 17:12
bQIik_cgjdlFeUNlL24vCg,haEwfqR_TqWqKijBA9olFw,bjhCtlYHrkgA5Ku8l-rB3g,5,0,0,0,"Great breakfast! The omelette was really tasty and the staff was very friendly.
My wife got the Huevos Rancheros and she really enjoyed it. 
They also have espresso drinks as well as a wide assortment of breads and muffins, pastry items. 
Highly recommend!",2016/7/30 19:43
rui57UcGZZ3YhD0uLfIGQg,xFxbX4ik1teSgCm425uA8w,bjhCtlYHrkgA5Ku8l-rB3g,5,0,0,0,"Five stars for the free sampled of pastries and bread alone. That's called legit sauce right there on a Sunday. Worked too because we bought some more baked goods after breakfast.

Waffles all out by 10:30 am.
Pancakes
French toast
Salmon eggs Benedict
Turkey Egg bacon croissant

Vegan friendly goods!
Kinda went crazy and bought 7 items.
What a feast.",2015/4/12 17:52
8ilOE7P-njtngB2FPy2LhQ,qouBraBPVMWmY3UlBvZXtw,bjhCtlYHrkgA5Ku8l-rB3g,4,0,0,0,"Ok, they have bread to that contains NO yeast. This is great news for me since I have a yeast intolerance. The new space is in a nice area of De La Vina Street. There is outdoor patio seating where you can sit in the sun or shade. The inside is a little noisy but still decent.  The space if more of a Bread Store than it is a restaurant so not a place if you want a quiet breakfast or lunch.",2015/4/12 22:12
guRpCeN8LRxkhqT100m1mA,o6UJMpHcpLJEvmKLrxLS3w,bjhCtlYHrkgA5Ku8l-rB3g,4,0,0,0,"Living downtown we hadn't been to their new location. We skipped Steve's today and came here instead. 

Ah...the smell of fresh baked bread, there's nothing like it!

I had the hot Chicken Pesto Sandwich on a roll. This was a tasty sandwich with the pesto not being too overpowering of the other ingredients. The chicken was moist and tender and the roll was fresh with just enough crunch.

My dining companions had the Gobbler and a half salad with chicken. Since there was no bread brought with the salad I simply went up and got a couple of the free slices that they offer. Problem solved for her!

The sandwiches come with a small salad with nice greens and tomatoes. 

This place suffers only from the standard, inflated, Santa Barbara pricing but the portions were ample.

Hi Egberto! You weren't there today but hope to see you around.",2015/2/15 23:36
s0YzEaAA80vOjU11ljaAkA,Qlum20MkEk-CyKSEpOfhUg,bjhCtlYHrkgA5Ku8l-rB3g,5,0,0,0,"I live close by to Our Daily Bread and had been wanting to try it for a while. They are right on the corner with bright orange awnings, which makes it very easy to find! They have outdoor seating and indoor seating. Everyone I went with ordered the breakfast burrito, and I added avocado to mine. So delicious! The burrito was huge and came with a side of potatoes. I highly recommend it. My party said the coffee was very good. I ordered fresh squeezed grapefruit and orange juice mixed together. Very yummy! Decently priced and the service was great. They also have tons of samples out to try various different items from their bakery, which I found very inviting!",2014/3/26 4:37
UDUIw7zrukAm4JNWNkJ4pA,XclLdtPG9UGPlePQ-ft9GQ,bjhCtlYHrkgA5Ku8l-rB3g,5,0,0,0,"After fits and starts at their new location, Our Daily Bread is back up to the top quality they had at their downtown location.  I had the Greek Salad the other day:  all top quality ingredients, fresh and local.  The carob-apricot squares are to die for, and I'm a total I-love-chocolate-and-would-not-touch-carob type!  Breads can't be beat.  Try the German Rye - so tangy it will make you pucker.  And it is impossible anywhere in the Tri-Counties to get a better challah.  The place is not perfect, though.  I acknowledge that the staff, though friendly, helpful, and delightful in almost every way, may not be as efficient as some of the zealous and busy might wish.  In their take-it-easy approach, they certainly reflect the Santa Barbara ambience.",2013/11/10 22:40
LABpOnUXq-vB0TIRlbw6GA,EM9nKYcd0UyNf_f0W1LEEA,bjhCtlYHrkgA5Ku8l-rB3g,5,0,0,0,"We visited the former location last time we were in town and really enjoyed it, so we decided to check out the new, larger location. Very pleased ... Excellent cappuccinos, and we had just returned from a week in Italy and had previously had trouble finding a decent cup. The salmon eggs Benedict was amazing, and the service was excellent. We will be back.",2013/12/27 13:56
MaZmj_jBXFiMos3q0WOrYg,wVuIwsYDsCE9eWe5HDBGeg,bjhCtlYHrkgA5Ku8l-rB3g,5,0,0,0,"We came in for lunch... what a treat!  We ordered salads and the choices were great, from traditional Greek to salads we'd never seen before, all organic.  After lunch, we treated ourselves to a shared dessert.  I had a square with apricot and carob and I am not sure what else and ended up getting more to serve for dessert to guests that evening.  And the cappuccino that accompanied it was as good as any in SB.  We also took home bread for dinner (again, we had guests coming), and everyone loved the focaccia and the baguettes.  Best bread in SB!!!",2013/11/10 17:04
3rfPL0OFGPImkJowtsqq2g,ym7uUZt8fVCgWgnaf2-4Rg,bjhCtlYHrkgA5Ku8l-rB3g,4,0,0,0,"They used to be located downtown, but the new location is pretty great. The bread and food is always nice and the vibe is very laid back and mellow.",2017/1/1 21:40
ZzeMeenKmSysPb_BwE7alA,DdII2mndHa1wJPvbck5W1Q,bjhCtlYHrkgA5Ku8l-rB3g,4,1,0,0,"We came here for lunch and sat at the outside patio. The service was good as the gentleman at the register was nice and attentive.  The food took awhile to come out (maybe ~25 mins) and it wasn't too busy (it was close to closing time). I had the Cubano and it was good, not the best I've had.  There was a lot of meat in it but it just wasn't too flavorful. 

The bread here is terrific. They always have plenty of samples out so you can really try their different selections.",2015/3/2 2:19
WNbAsP3WZZ6NdOf46enI-A,8qCYYooUZVFVtx-Yb79vRg,bjhCtlYHrkgA5Ku8l-rB3g,4,0,0,0,The family and I wanted to walk to breakfast... Decided to try the new Our Daily Bread. We weren't disappointed!  Breakfast was yummy. Though we are had sweets and coffees. Though the egg dishes on the table next to us looked delicious.,2014/5/11 17:25
KhNSparnSEwiXJTOfZE-kQ,cdMEwUScfCCET2K-AHPEhA,bjhCtlYHrkgA5Ku8l-rB3g,4,0,0,0,Great spot. VEry friendly staff. BEautiful interior and pleasant atmosphere. Very tasty food.,2017/2/13 13:55
R4Ts8ejPt5Yp2C6O6DGHFg,efH7kVUs_s4rrubNKue6Hg,bjhCtlYHrkgA5Ku8l-rB3g,4,0,0,1,"What I tasted from samples was awesome. I ordered an omelette with goat cheese spinach and turkey bacon along with avocado and creme fresh. We also ordered the gobbler and banh mi...

After eating it the verdict is really great. Omelette was spot on. The Banh mi was great, could of used a little more flavor and filling. Bread was delicious. Cranberries on the gobbler were extremely tart and made my mouth dance after the savory turkey bacon in my omelette. Then all that was left to try was the tuna. Fresh and basic. Better late then never was the arrival of sourdough toast with butter. AWESOME. We enjoyed our lunch and time together.",2017/11/27 22:02
WdYPQ8rCXslFQ2InUV4Iyg,ZBLZIOrO3DZJzDFlFO-bJw,bjhCtlYHrkgA5Ku8l-rB3g,4,3,1,2,I love being able to sit outside to have breakfast at this location. I first heard of ODB (not the rapper) when I had their bread at Montecito Cafe. I came here for lunch and really enjoyed their breakfast selections. The staff I interacted with were super friendly as well.,2015/8/19 22:12
2ulsJ6gAp7OQ2qb1rojoNQ,Lbgzuo_pWymzsUaiEtUFVQ,bjhCtlYHrkgA5Ku8l-rB3g,4,0,0,1,"Love this place!  Best fresh bald bread around and an awesome place to come in the mornings for a nice breakfast. 

I had just been in San Francisco and had crazy good toast at The Mill. There's really no one doing toast in So Cal except for here. Huge thick pieces of toast served with fresh ground peanut butter and homemade strawberry preserves. Seriously - this whopping piece of toast was enough for 2 people. 

I know they supply a number of local restaurants with their bread but it's great to stop in here and pick up a loaf for yourself at home. In the mornings, they often have a selection of their fresh loaves cut up for you to sample. Fantastic!!",2015/4/27 3:46
1Lj70GTisoJAfV9_bg_vdg,zUNe59ea0rhJKvND-jD8Aw,bjhCtlYHrkgA5Ku8l-rB3g,5,0,0,0,"What about waking up on a Sunday, enjoying delicious breakfast, espresso and squeezed orange juice while taking some sun on a terrace in such a beautiful place that is Santa Barbara?

This makes you dream, right?

Closer, let's zoom on what's in your plate: blueberry pancakes, orange flavor maple syrup, scrambled eggs, bacon.

Makes you salivate, right?

Well, try it next time when you'll happen to be in Santa Barbara, and wish to enjoy the silence of a early Sunday morning.",2015/4/27 19:25
2rqoGnK7vGcfdJjsP3h7Gw,iljaiQvX4cgAmkXS3CAgmg,bjhCtlYHrkgA5Ku8l-rB3g,5,0,0,0,"This place is excellent. The food is delicious, and the service is always overwhelming friendly and fast.",2017/3/14 16:38
