review_id,user_id,business_id,stars,useful,funny,cool,text,date
L0jv8c2FbpWSlfNC6bbUEA,bFPdtzu11Oi0f92EAcjqmg,IDtLPgUrqorrpqSLdfMhZQ,5,0,0,0,"What a great addition to the Funk Zone!  Grab a bite, grab some tastings, life is good. Right next door to the Santa Barbara Wine Collective, in fact it actually shares the same tables.  We had a fabulous savory croissant.",2016/10/13 22:50
LFpaQzYkP5Pzm5lEjJpTRw,Ttb21DpWqphQMNSS5TXgMA,IDtLPgUrqorrpqSLdfMhZQ,5,0,0,0,"Possibly the best breakfast sandwich EVER.  On a biscuit!  Oh my gosh, it was so good!",2017/1/15 0:36
Q3fPo_x6xKxafAzy1hFITg,ha2Lv7WnxvdYnRsqwL1apQ,IDtLPgUrqorrpqSLdfMhZQ,4,0,0,0,"Pricey ( a ham and cheese croissant was $5.50)  as with anywhere in Santa Barbra but very delicious. Cute space ( a bit hard to find ). The green eggs and ham  breakfast biscuit is to die for.  ($10 I think) The Santa Barbra tri tip sandwich was excellent! Cold brew coffee was good. Lots of good choices in the grab and go section, and our salami and pesto sammy was also great. I'd go back!",2018/7/17 0:20
_OmwsZRl7Qrz7S2T8mnlRg,OVLf6NVTi7noMP1qCKr76w,IDtLPgUrqorrpqSLdfMhZQ,5,0,1,1,"Are you kidding me? This is without a doubt some of the best food I've ever had my life. The bread is the best, and I cannot believe the chocolate croissant. Ambience is wonderful, intriguing, and very chic. People are friendly and kind.  Coffee looks great but I didn't try it (yet! I WILL be back) Prices are good, too.",2018/1/9 20:44
84DfCtrRKeRBqJpI1Pzyeg,EtayGG2z0YOWNbw6p6AG0Q,IDtLPgUrqorrpqSLdfMhZQ,5,0,0,0,"The best chocolate croissant (petit pain au chocolat) I had in USA!  I like the atmosphere, very industrial look. The place is shared with a wine bar, so you can have an excellent sandwich made with a French baguette and a glass of wine. It was too early for me. I would recommend this place.",2017/12/2 21:55
iFuGbpGMM35BTFDlNZcSvg,Hj3wDruCns_CHs17t1HhBw,IDtLPgUrqorrpqSLdfMhZQ,5,0,0,0,Green eggs and ham sandwich was delicious. The biscuit was peppery and perfectly baked. We also had the ricotta toast and I was pleasantly surprised at how tasty it was. I highly recommend this place for an early morning breakfast spot.,2018/8/5 0:40
fsewvP9cIPuSqJd_SufuOg,FdI6GJ-Jvt7L1byPYWJegQ,IDtLPgUrqorrpqSLdfMhZQ,5,0,0,0,"Seriously the best breakfast I have had in a long time- it is pricey but everything here in SB is - breakfast bun, choc croissant and the yogurt dear jesus- excellent cappuccino as well - go there now",2017/10/25 4:02
0I5JlTfKHsuzUuPYe-Bswg,9EVsfFOCEP-7L37HPzsOSA,IDtLPgUrqorrpqSLdfMhZQ,5,0,0,0,"Got the babaganoush and baguette delicious.
Service was good it gets busy but not too crowded",2017/7/8 18:07
P6XOsk0bjQ5nVbTAKuXN0Q,qEB91YxnzkQZwMFyWeVOHw,IDtLPgUrqorrpqSLdfMhZQ,5,0,0,0,"While on vacation in Santa Barbara, we happened upon this gem.  Everything was wonderful, but you have to try the cinnamon roll with the vanilla bean glaze.  It was AMAZING!  So good, that we bought another for our trip home.  Additionally, the breakfast biscuit was outstanding.  I loved that it was perfectly proportioned and I love every bite down to the last crumb.",2017/5/27 2:10
NN2WGLjM1o5EP8wtGtDtxg,HujQufkU2Y9lpZmeGkk5AQ,IDtLPgUrqorrpqSLdfMhZQ,5,1,0,0,"I've had a wide sampling of what HAB has to offer, and it's all so very good. You can't miss trying their churro and chocolate nib donuts. At least once a week, I stop in for a baguette to take home for dinner, and have been impressed by their single-serving size quiches. Seriously, the food is excellent quality (especially their farro salad), and the prices are reasonable for their gourmet offerings. Do yourself a favor and check them out!",2016/9/20 17:11
#NAME?,iF3JiTRyMhje4MHl0mq8wA,IDtLPgUrqorrpqSLdfMhZQ,5,0,0,0,In Santa Barbara? This was the place to chill and relax for some refreshments and snacks. Nice little get away from the beach.,2017/9/23 14:14
kbjOOg875iXfcqZW7TZQkg,wVd2FUpKVLGURVCb-HGgOg,IDtLPgUrqorrpqSLdfMhZQ,5,0,0,0,"Yes yes yes

Not only do they provide top notch customer service and hospitality the product needs they over exceeded our expectations. I have been in the industry for 22 years now and I have to say the bread is Absolutely delicious and the flavorful and holds its integrity overtime. We will definitely be returning back to purchase bread for our trips.",2017/5/17 16:14
39meD0CwHgnVRwhKHLsOkg,5lRrVUVfENhIXvlfPSoMqg,IDtLPgUrqorrpqSLdfMhZQ,4,0,0,0,"Roast chicken sandwich was delicious, but be careful.  The assistant manager felt no remorse that they served the sandwich with a 2 inch long chicken bone included. Makes the whole restaurant operation suspect... Gordon

Follow up... Chef Jose Guido of Lucky Penny (a related food service) approached and apologized for the mistake in food preparation by the staff at Helena Ave. Bakery. He also offered us cookies in compensation. Revising my review of the Helena Avenue Bakery to 4 stars",2016/11/22 1:19
W2Xcdnb88w78BqON7Sw3qA,FrgJ8DdeXEF1GkAjT3JR2Q,IDtLPgUrqorrpqSLdfMhZQ,5,0,0,0,"Santa Barbara was in need of a great bakery and this is it! A group of us tried the turkey & pesto sandwich, the ham sandwich, coffee, a peanut brittle cookie, a blueberry hand pie and the peach galette. We also got a loaf of bread to go. All was super delicious! And as a bonus, they share space with the Santa Barbara Wine Collective so you can get a glass of wine with your tasty baked goods! Really pumped about this new add to the Funk Zone. I know we will be back soon.",2016/8/27 21:27
zhC2FHbKKUNwKwHhRa-kag,hPiOLWvv3rPvf1eFbNCl5g,IDtLPgUrqorrpqSLdfMhZQ,4,0,0,0,"4 stars for location, atmosphere and orange juice. I didn't like their breakfast too much. My bagel was burnt and not enjoyable and my granola & Yoghurt was too bitter. I stopped by at 10:00am and it was quite busy- I didn't get a table outside. It's a nice enough place if you just want to stop by and have a low key breakfast but don't expect too much. It's all about the atmosphere/location.",2017/5/27 21:52
HAYxlGv5OM9C3eWBk9C1ZQ,Erb0-2k6eS-2Xw77duOCpQ,IDtLPgUrqorrpqSLdfMhZQ,5,1,1,1,"Okay I can't say enough about this place!! Soooo good! Came here for dessert and the cookies were to die for! Best cookies I think I have ever had... located in a perfect spot in the funk zone- very industrial looking inside which I like. Also located in a spot where they have wine tasting, community style seating- which is fun! All around great atmosphere/ I can't wait to come back and try the breakfast!!",2018/6/26 19:31
MSIPI3u0IujwmtUgcZKN0Q,U_d4gAI1w29nWWqf7CDZBw,IDtLPgUrqorrpqSLdfMhZQ,4,0,0,0,This place was a short walk from our hotel and a wonderful find!  Awesome ambiance with very pleasant service. My lemon blueberry scone was the best I've ever had anywhere and full of berries. The ham and cheese croissant was delicious too. Took some fresh made bread with us to take wine tasting later this afternoon. Also noticed it is located near Figueroa Mountain Brewing Co so perfect if you want a sandwich with your beer.,2018/3/24 15:20
nR1d2Ib4aRXWxPATAcLo3g,OZ1NmK2RLv0UxGFABE0CHw,IDtLPgUrqorrpqSLdfMhZQ,5,1,0,0,"By the time we got here, our bellies were pretty stuffed. So all we ordered were two cookies: the Chai Snickerdoodle and the Peanut Butter Brittle. Both were simply delicious. The snickerdoodle was thick and puffy and soft - and filled with all the warm spices of chai tea. Meanwhile, the PB cookie had rich peanut buttery flavor, but with the sticky, hard crunch of the included bits of peanut brittle. 

We sat outside on their lovely patio and wished we had room to eat more!",2017/1/3 20:25
hOH-l1xIsgNaVassZJZJIg,otccM_mkWEKnvO2YMc-xOw,IDtLPgUrqorrpqSLdfMhZQ,5,0,0,0,"I dream about their biscuits now! And the butter and jam they serve them with are outstanding as well. The fluffiest warm biscuit with butter from the happiest cows it seems like, and raspberry jam with a hint of thyme. I don't think anyone does biscuits better than Helena!
Everything we've tried so far is really good, can't go wrong with anything here.",2017/7/29 21:33
RZ0m7FstqaA737bhEiJy3g,iY8r5E1QzcvFgOvDWGXMrQ,IDtLPgUrqorrpqSLdfMhZQ,5,0,0,0,Authentic.  Delicious. The Green Eggs and Ham  their signature dish.  Just gobbled up the lemon blueberry scone. Outstanding.  They just need to offer Oat Milk for their lattes and all would be perfect in heaven!,2018/8/26 17:47
wzKUYHqrr5XQTGngKZ80Gg,h8XbYeU8d8f6siG85jAZfQ,IDtLPgUrqorrpqSLdfMhZQ,5,0,0,0,Terrific baguette sandwiches and pastries. Industrial funk atmosphere- friendly staff,2017/9/23 20:54
D6pIyHuAgML2x81vq0LKjA,E1USuGuIQlNyZf7-3_3hGg,IDtLPgUrqorrpqSLdfMhZQ,4,0,0,0,"Great bakery items in a super trendy cool setting. The breads are spectacular, si is the coffee. Located in the Funk Zone. Lots of fun places to walk too....",2017/8/19 18:52
IJ8Etz82GeGSXs2zBDbNBQ,fWkGUihvo0XFMNyfoT-lIg,IDtLPgUrqorrpqSLdfMhZQ,5,0,0,0,"Had the lentil soup and went back to buy some bread for later because it was so fresh! They have a great selection of breakfast, salads, sandwiches, coffee, and baked goods. Everything appears fresh and well made. The space is shared with a wine tasting room and is very open and spacious. There is a lot of seating but it is also a great place to grab a coffee and pastry to go.",2017/8/9 22:03
B3HH_C_I33-zAyiFOBnPFQ,JDOlID7QqBhlHIZnMyoBtQ,IDtLPgUrqorrpqSLdfMhZQ,5,0,0,0,"We tried the macaroons and chocolate chip cookie and they were divine
We were just walking by and checked it out and decide to try it and highly recommend them",2018/7/30 22:37
qfki5CHomxjDA9jzz990iQ,ptmYa3lHCK5r355cvLNNUQ,IDtLPgUrqorrpqSLdfMhZQ,4,0,0,0,"Inside the wine collective, an interview and loud atmosphere houses a very nice bakery and coffee shop. 

Choosing to sit outside, we split a large cappuccino, grapefruit muffin, and cinnamon donut. 

The donut had an almost baked texture. It was good. The muffin was excellent! Very different flavor. 

Try them out, we were glad we did.",2017/3/12 18:38
zOypDpZ8wHoINpdZ6Yu6Jg,a09oNJYPMBxfYw2kVAUN_g,IDtLPgUrqorrpqSLdfMhZQ,4,1,1,1,"First time at Helena Av Bakery.  It was a bit confusing to locate, initially, as the address is Anacapa Street and it's not actually on Anacapa.
The bread was delicious,  the sopressata sandwich was divine, as was the green bean artichoke salad.  I was surprised and disappointed that the salad was not accompanied by 1-2 small slices of the baguette. When asked, the server said I could order a 1/2 loaf of the baguette (which I did), though that ended up being just too much.   Also, I would recommend not slicing the whole 1/2 loaf, rather, just make the single cut and leave it to the customer to tear it apart.... I'm hoping what I brought home will taste as good as those I ate with my salad.  All in all the food was very good and I look forward to returning to test other menu items.",2017/2/16 22:53
FPsbvZMpqRyzYxaCj7_VDQ,xzih2cVwAP9zXoLmi3e7ag,IDtLPgUrqorrpqSLdfMhZQ,5,0,0,0,"Wonderful brunch option in the Funk Zone. Food is fresh and biscuit sandwiches are made perfectly. I'd recommend Green Eggs and Ham for sure and am planning to go back and try all the baked goods as well. Also, sharing the space w a wine bar is a nice touch ;)",2018/2/6 17:38
74usfGu09q-ftJJd3bvmfg,hIQvAz7dTtMJcVLXBV8xbw,IDtLPgUrqorrpqSLdfMhZQ,5,0,0,0,"Can not recommend enough. Coffee, mocha, morning bun (warmed), breakfast biscuit sando, avocado toast, yes I had all of this and it was amazing. If I lived next door I would be 400lbs. I love this place! Everything you hope for when the sign says bakery. One day server was a bit dingy next day awesome but ey, shits tough out there.",2018/5/1 4:18
Znc7zDIg1pNepcGE3QwDrg,1uDl8qzscFe0E5V1WARH6g,IDtLPgUrqorrpqSLdfMhZQ,5,1,1,1,"I honestly adore this bakery in Santa Barbara! I don't get many chances to wake up on a Sunday to gorgeous weather and be able to casually enjoy a small morning snack but for the first time in a long time, I was finally able to do this! No better time spent than at Helena Avenue Bakery. The only way I can describe the vibe here is modern rustic with a cute outdoor seating area that's shaded with umbrellas. A small part of me was making comparisons between this place and Republique in LA which is a huge compliment given all the great things about Republique! The scale of their menu and baked goods are much smaller though but the vibe here still somehow reminds me of Republique. I chose three items to share between 2 people. 
-Matcha Latte - fairly standard, price about what I expect for the size, would recommend getting a hot one
-Blueberry and Lemon scone - I'm not typically a scone persony but I really wanted to try this one out. I wasn't disappointed! Lots of blueberry with a lemony glaze. The scone was flaky on the outside and soft on the inside.
-Peanut and cashew butter with Banana toast - Hands down one of the best nut butter mix spreads I've ever had spread thickly over perfectly toasted sourdough bread. I wonder if they make it in house or if it's bought from somewhere because....I need more of this! The thinly sliced banana pieces cover the entire toast topped with bits of rosemary which just adds that extra flavor kick. As easy as it sounds like it is to make this at home, enjoying the toast here was pretty darn delicious. 

Overall, I'm a huge fan, I would definitely come back if I visited Santa Barbara again. I wish they had a larger variety of baked goods to try!",2018/10/2 3:39
QeXo69OyRzlo-CrTXuVs3w,QWKPQiqH_o_ARgpldmB1CQ,IDtLPgUrqorrpqSLdfMhZQ,4,0,0,1,"We checked out this new addition to the funk zone and it was tasty! 

We tried the focaccia with cheese, tomato, red onion and kalmata olives. It just came out of the oven, so delicious!

We also had the peanut butter brittle cookie. It was soft, chewy and oh so good!!

The also sell sandwiches, a few sides and bread to take home. 

We will definitely be back to try more of their delectable treats!",2016/7/11 14:42
ru_1gjdXMVaYwZERj5pBaA,edZ6kTxithgtctw1crIkBA,IDtLPgUrqorrpqSLdfMhZQ,5,0,0,0,"Sticky Bun.
Cinnamon Roll.
Green Eggs & Ham Biscuit Sandwich.
Cold Fried Chicken Sandwich.
Potato Salad.

Lovely Place.
Friendly Staff.
DEEEELIOUS Food! 
Would love to return the next time in Santa Barbara!",2017/4/13 1:02
ViOLxru3wudSpUpNAdbBEw,W85gPWNx1V9Ug3dHPmU9zw,IDtLPgUrqorrpqSLdfMhZQ,4,0,0,0,"Great southern breakfast. If you like biscuit then you'll love this place. Every time I'm in town I make it a point to have at least one breakfast at Helena's. Furthermore, the indoor/ outdoor space is awesome and filled with locals. Great vide!",2018/4/21 19:49
gPIBGmMdPNXb0-mGK-Jrpg,uIZWBUF9ovbXWG2dVJ6Zfw,IDtLPgUrqorrpqSLdfMhZQ,4,1,1,1,"A friend recommended this place for breakfast.  The place is a multi use venue with food served all day and the addition of a wine bar in the evening.  Order up at the counter, get a seat, and wait for your food.  Seating is communal but their is plenty of space so in the morning everyone was spread out.  I had the green eggs and ham and it was really good.  Definitely worth it. 

Place can get busy so come early.  They offer self serve water but needed to fill it up more often.  Lines for the bathroom could get long as they were single use only.",2018/6/5 8:10
Z93HeNTmhaw-HF_imyUBxw,bzFZRaRb77TeeGm0aPHH5Q,IDtLPgUrqorrpqSLdfMhZQ,5,0,0,0,"Cute, hip, bakery. My ricotta with honey toast was sooo good, much bigger than expected. We got blueberry muffins and a fruit bowl for the kids, nice variety (not just melons). Looking around at everyone's order I wish I could have eaten more. Will go back so I can try more items on the menu. Even though it was a little hidden, almost missed it, we got there just in time, the line got really long!",2018/4/10 14:23
3IUJQbUyfFT2sTlnQfYHZg,KwmCVim-gwroACkIXVdWaw,IDtLPgUrqorrpqSLdfMhZQ,5,0,0,0,"Fresh and local delicious bread! I've had the Rye and Sourdough loaves, some pastries, almond milk lattes, and l look forward to trying a breakfast sandwich the next time I'm in town. The staff is friendly and some good tunes can be heard depending on who's working;)",2017/7/3 23:16
K5RjsZot6a9LCl3YzV4B0w,MOEt1R4_8s8aC0myFO6zTA,IDtLPgUrqorrpqSLdfMhZQ,5,0,0,0,I had the best cinnamon roll I've ever had in my life. Tastes even better if you warm it up. The cappuccino was also really good. The bakery is located right behind the famous restaurant called The Lark.,2017/6/11 3:06
J9J5Yt--k3DvMwudSmQMCA,Zi3Fm08v1sTMn4rktxci4g,IDtLPgUrqorrpqSLdfMhZQ,4,0,0,0,"Friendly service. The blackberry panna cotta is a must try. It's soft, creamy, and smooth. These stores definitely embrace the open and shared space concept. I came expecting a full on bakery, instead it is more like a cafe with lots of inside and outdoor seating. It is nice and cool inside on this hot summer day. Perfect for sipping on our mochas or lattes while enjoying a pastry. A tour group came in and they were served the galette, which looks amazing. I should have ordered that instead of the donut. Although the donut was tougher than I thought (resembles more like the texture of a bagel), I still enjoyed it nonetheless.",2017/7/13 21:35
Gq92LLwo_Yx_2sRIz-uFqA,x3O2iOFT7n64ZEXv_yxZ1g,IDtLPgUrqorrpqSLdfMhZQ,4,0,0,0,Great lattes! Very trendy place--- cute little patio seating in the sun. Wish they heated the bakery items tho.,2018/4/9 4:28
3R-Z4rq34yCScxZ5bKoiUA,dO_IwsLvn-yyDwO6352arw,IDtLPgUrqorrpqSLdfMhZQ,4,0,0,0,"Really liked this place.  Off the beaten path, nice pleasant atmosphere, great outdoor space.   I had a very good tea and scone.",2017/11/13 19:30
umEj4veLgppnh0sDIEX0fQ,04phLe82L4L8QE3yW7uY5Q,IDtLPgUrqorrpqSLdfMhZQ,5,16,9,10,"So if I lived in Santa Barbara I think I would find myself in this bakery each day with my laptop eating the great fresh breads they have while drinking a solid cup of coffee. The ambiance is awesome and their food is excellent. If you are wondering where to head for a light breakfast or a coffee and morning bun, this is the place. An awesome wait staff and incredibly warm and welcoming feeling. Definitely don't miss it if you are in town.",2018/4/23 0:44
GASDiG6rXbv390uwXvhQ1w,7tupM0jB7h7hSELCuSiN1Q,IDtLPgUrqorrpqSLdfMhZQ,5,0,0,0,We ate breakfast here two days in a row. They have really nice pastries but their green eggs and ham breakfast sandwiche on home made biscuits are amazing. Would definitely recommend.,2018/6/24 15:17
3vMvXOSlJhYJL6Ix2YshhA,MZvpZZ8CuUhwgMbyaFkIAw,IDtLPgUrqorrpqSLdfMhZQ,5,0,0,0,"Nice ambiance. Large open doors. For breakfast, all bakery items are good. Then come back in the afternoon for wine.",2018/7/22 20:28
VxC2XWpgNIk8B02cVCdhsA,uYvoEm3MjKrIMFDnsmXJHA,IDtLPgUrqorrpqSLdfMhZQ,4,0,0,0,"OMG!!  The sandwiches at this place are absolutely fabulous!!  They need more of a selection but wow, I can easily say the best in town.",2016/7/28 2:52
1-zJuZvZt3xMw5O3KyHX_A,rO294JiIKEsXGdjJhakdsw,IDtLPgUrqorrpqSLdfMhZQ,4,0,0,0,"Wonderful space with good food. 4 stars instead of 5 because by the time we arrived around 2pm they were out of multiple items on the menu, but I suppose that's not too uncommon at bakeries. Nice seating options both outside and inside. Not a ton of vegetarian food options but the sandwich I did get was great!",2018/6/6 3:45
glWA3YmWASBePLe397kEYA,NIRmYlZRypHhXOr1fqL83w,IDtLPgUrqorrpqSLdfMhZQ,4,0,0,0,"The service is great and the food is good. I was a bit disappointed with the machiatto and my matcha latte -- those were not what we were expecting. The macchiato was like a shot of espresso..I had asked the cashier about that drink specifically because those tend to be made differently everywhere we go (I don't know why) and he did not seem too familiar with the menu, so I stopped asking and I went ahead and order for my wife and I. I was able, however, to just replace my macchiatto with a brewed coffee after I was not satisfied with my drink.",2018/5/24 15:45
HaUKVMPzMeQ9Ghgm-rYh0A,ctOCYihyz_rzK10rsZVxWg,IDtLPgUrqorrpqSLdfMhZQ,5,0,0,0,"I had a scone, but it was like no other scone I've had before. It was glazed, soft (so soft). I don't know what it was called but it was so good",2018/3/31 22:56
w49J0eQE4kgM5-6OJvM8aA,l_urxDubusB1pn_VYOssuQ,IDtLPgUrqorrpqSLdfMhZQ,4,3,1,2,"Morning breakfast date 

Ordered: cinnamon roll, chocolate zucchini bread, iced vanilla almond latte, vanilla latte

Pros: The bakery is in a shared space with a time tasting place. Its has warehouse, industrial and french vibes. It's beautiful and open! They ah e patio seating and all the seating feels community focused. Both pastry items were delicious, moist and the frosting to cinnamon roll ratio was spot on, the service was fast. The coffee was delicious and sweet enough for me! 

Cons: parking may be hard but that's expected, their breakfast biscuits looked delicious but overpriced in my opinion even for quality, because it didn't come with sides. 

I will go back!",2017/7/16 20:30
nF-UBdfM6T0uzV9mLYrHXQ,wnCBii8RavTwViB52QgEMw,IDtLPgUrqorrpqSLdfMhZQ,4,0,0,0,Great atmosphere...loved the tomato soup and bread...Will definitely return when in the area.,2018/2/7 2:49
17ImP6zxqz-8sPI9xrUvIg,Z5JJ1e95WSo8Bsw_zvl8HQ,IDtLPgUrqorrpqSLdfMhZQ,4,0,1,0,"Apple Fritter madness, so good. Egg sandwiches good but maybe a bit over concocted with sauces, veggies etc. How about a good old fashion egg and cheese? They need a greater green tea selection.

Great decor, nice staff-I'd come back.",2018/3/3 1:38
7G_FFtm1jLfdUhRaOTI5ag,Piz2ztQj21aeYurUmOVmsQ,IDtLPgUrqorrpqSLdfMhZQ,4,0,0,0,"We came here for a late lunch while wine tasting/exploring the funk zone.  It is located inside the Santa Barbara wine collective and we were lucky enough to grab a table and some wine as well.  

They had lots of options on their menu, however since we were there a little later in the day they were out of most of their sandwiches.  I got the turkey sandwich which was absolutely amazing, I loved every bite of it.  My friend is a vegetarian and unfortunately the only sandwiches they had left all had meat in them.  She opted for the chickpea salad and was not very impressed.

They're a bit pricey, but most of the other places don't serve food so they can get away with it.  I'd definitely recommend stopping by earlier in the day so there are more options available especially if you are with picky eaters.",2017/10/1 16:24
ilVidPvQ1_gce9GJxTDtjQ,RKL0Q0pMwFz2EYzRz8U-2Q,IDtLPgUrqorrpqSLdfMhZQ,4,0,0,0,"Eating the turkey and Brie sandwich now. Very oniony, but very delicious. Great combo of flavors. Their bread is so good I think anything would taste good on it.",2017/4/14 21:45
AcF6oNUwq6eu5Wl3ficyvw,Ts349MFBYnc6Cw4BHQZz2A,IDtLPgUrqorrpqSLdfMhZQ,5,0,0,0,"OMG... The bread here is super delicious, soft, moist, and perfect! The best bread I've had! Oh, the soft butter with a hint of sea salt was off the chart! I'm salivating writing this.",2016/9/4 5:11
rLo6ff9KuuFTSt8T4ozSqA,ooyE6Ny7FXho6F-tG-9H-w,IDtLPgUrqorrpqSLdfMhZQ,5,1,0,0,"Great sandwiches! Addicting. Expensive, but worth it in my opinion. Really glad to have them across the street from where I work.",2016/9/26 5:51
LSB8p323WEBwxLtPqmM5Pg,yF61umi5A_BJg63LX3tZvA,IDtLPgUrqorrpqSLdfMhZQ,5,0,0,0,"Got the buttermilk biscuit, bacon, and fried eggs sandwich it was very good and the gluten free blue berry muffin would definitely try this place again when I visit Santa Barbara again!",2018/9/11 19:35
oFtgQKS4xTrvvgL2eTZKHw,wmGl1hp-0Fb7rkjAfCtV0Q,IDtLPgUrqorrpqSLdfMhZQ,5,0,0,0,"Got a breakfast sandwich. Biscuit with egg, bacon and cheese. It comes with greens and some tomato spread, i didn't want that. It was delicious. Cold brew decent also. Cashiers were sweet and accommodating. The girl serving the food had a flat affect. Ambiance is a chill, open, industrial vibe. I wish the outdoor space was larger. There is a wine tasting area in the same spot. Would come here again just for that biscuit!!",2018/5/6 19:20
mUcZhDwLJKUJXwGcqij_gg,0zf5FoDry73XzjjadN56mw,IDtLPgUrqorrpqSLdfMhZQ,5,1,0,0,"We came here to get picnic eats at the picnic counter and were really impressed. The sandwiches were delicious and fresh. My favorite was a baguette with roasted bell peppers paired artfully with spicy arugula and creamy goat cheese. We also got olives, kale salad, and a cinnamon bun- all tasty. I do wish the cinnamon bun had more cinnamon in the outer layers- but that's the only criticism. I will definitely be back next time I'm in the area.",2017/3/21 4:40
IQNLvJ-UN9I17o3S93WHdA,#NAME?,IDtLPgUrqorrpqSLdfMhZQ,5,0,0,0,We visited this location for the first time on our vacation and ended up going back because the food is so delicious. The service is amazing too! There is outside and inside seating with a chill atmosphere.Definitely try their PSL which made with fresh  pumpkin and their biscuits/ gravy.,2018/10/29 4:06
wLGnweKowZYbCEJXGUuiSQ,rkX-NktEvc8ebR2MSYyhrg,IDtLPgUrqorrpqSLdfMhZQ,5,0,0,0,Hot pretzels house made and fresh from the oven.  AMAZING!!!  Coffee and pastries great too.  Nice little find near the Children's Science Museum.,2018/2/19 19:30
wSbNbTwbUa4Uy5JGyxLM7A,IjJZtMgk0IA2PSGRM5_2Tw,IDtLPgUrqorrpqSLdfMhZQ,4,1,0,0,"This is such a cute little spot- we stopped here on our way from SB to LAX to drop our friend off to airport then head to SD for a flight of our own. 

The customer service was great, prices were ok, the wait was a little lengthy.  We waited for about 10 minutes for 3 quiches to be heated managed to get a scone out of it and our three drinks. 

Great little spot and a gem hidden in the streets- if I ever cross the SB lines again I will be stopping here for sure.",2019/12/19 20:21
