review_id,user_id,business_id,stars,useful,funny,cool,text,date
x3_06ZsfV4IGqTmndXWS2A,dRFGUF-qJLp3ZFOUvv2KUg,IDtLPgUrqorrpqSLdfMhZQ,4,1,0,0,"The baked goods that we ordered were absolutely delicious and I can be pretty critical about baked goods...I expect a lot for that many Calories!   Chocolate croissant... just the right amount of chocolate plus tender yet crispy and soft... wonderful flavor.  Chocolate Chip cookie... chocolatey and good texture and flavor.   Bacon, egg and cheese sandwich... wonderful combo with arugula.  It came on a tender biscuit... flavors came together very well.   Quiche... big serving and good flavor.  The only reason for 4 stars instead of 5 is because we could see right into the kitchen (good thing)  and saw the employees using their phones to text and drinking coffee while prepping food (very bad hygiene.)  I can't believe that was happening actually.",2018/1/29 18:27
cz9AbiSSa3mE3hpHbBaP5g,dA3ffUCMiGIGXUWYrWfdHA,IDtLPgUrqorrpqSLdfMhZQ,5,0,0,0,"Once again does not disappoint! Came here over a year ago and couldn't forget how delicious it was especially the peanut cashew butter! Stopped by on our way north and feasted again on such flavorful unique dishes even the simplest Ricotta Toast is flavorful and filling! Freshest ingredients generous portions served in a relaxed atmosphere where you can hear yourselves talk is the recipe for a perfect spot to treat yourself on Santa Barbara. For the kids you can order house-made bagel toasted with peanut cashew butter or jam and there are board games for all to play.
Today's sampling was 
California Turkey Sandwich with Cheddar big enough for two 
Green Breakfast Bowl totally unique but so tasty and filling",2019/8/11 19:24
R8YRZca1KfQ-3PR1Lb8CDQ,_jsZl-USMgrVVasNg50wAQ,IDtLPgUrqorrpqSLdfMhZQ,5,0,0,0,"Love this place, my go to breakfast when I'm in Santa Barbara...scones are perfect texture, yogurt and granola; as well as, the breakfast sandwich are all high quality ingredients and delicious!",2020/2/22 18:12
TrKDCJuHbwE5hFYCfxExUw,HaTVMedOQDMAg6e-KHrKUQ,IDtLPgUrqorrpqSLdfMhZQ,5,0,0,0,"LOVED Helena Avenue Bakery! Came in for brunch and my friend and I got a whipped honey and ricotta toast, an avo toast, a couple of lattes and a freshly baked biscuit for the table with complimentary jam. It was the perfect amount of food and SO yummy! 

There was a bit of a line (probably because it was 11am on a Sunday) so maybe if it's the weekend try to come through early or late. 

I will be back!!! 鈥",2020/8/31 4:37
7eTevb0NOzSg_CPrfi2o6w,17974zB-sZLu-T4kZ28qxg,IDtLPgUrqorrpqSLdfMhZQ,5,0,0,0,The cutest little bakery in Santa Barbara! My husband and I each had a breakfast sandwich with best biscuit I have ever had. Everything was incredibly fresh and tasty. Highly recommend!,2019/9/7 23:55
XXZ2yUhQLhmOta0Wg7wrTA,hj6bHxcTRCPVhanRL5neGA,IDtLPgUrqorrpqSLdfMhZQ,5,0,0,0,"Been coming here since they opened and consistently been great.
1. Good vibe.
2. Fabulous quality food and just enough choice...and some menu items change seasonally.  
3.  Drinks: Good oat milk & refreshing changing specials like try their new organic peach soda for a refreshing drink or and if you want a cappuccino ..know to ask for it wet or dry depending on how you like it...
4. Shout out to Kyle the manager who always remembers our name, is so dialed up and has a great smile.  Shout outs to Caspian, Victoria, Sierra, Nicole, Alana, Dafne & Noah and the team there that are always friendly and kind.  Even when the line is long, it moves fast and the staff don't seem stressed nor do they rush you...yet the line and service moves along nicely.  
We go so often that we have gotten to know the staff who are professional warm and helpful.  I have never been to a morning place until now, that consistently has kind, awake and happy staff. Thank you
5. Location...fabulous...and then enjoy a walk along the beach or in the Funk zone after your meal.
6. Local organics...my understanding is they support local organic farmers and thus you are eating healthy thanks to that..and supporting the local community and leaving a smaller footprint. :)  Thank you Helena Bakery.  Thank you Acme Hospitality!",2019/6/30 22:59
PXcGkC5FopOuOjPaBVA7DQ,wvd7JQ_7ILvhdeNXoYOiZA,IDtLPgUrqorrpqSLdfMhZQ,5,0,0,0,"What a lovely bakery in such a fun part of SB!
The gal recommended the savory tomato tart, omggg if they have it, get it! The perfect pastry with a layer of cheese, tomatoes, basil and almost ljke everything bagel seasoning around lol. Basically a lighter mini breakfast pizza. Need more ASAP. The avocado toast was also delicious, thick rustic sourdough with avo, sprouts, feta and cucumbers. Got an oat latte which was good, the drip coffee was a little lukewarm and a tad acidic but overall had a good experience and would def recommend!",2020/9/6 18:01
scW9vPFU_04l4xOZxsSIUw,Tr9BLxlG2RbrCSypT05wkg,IDtLPgUrqorrpqSLdfMhZQ,5,0,0,0,"Sensational shock to the tastebuds! Never have I tasted food so exceptional. This wasn't just a scone, it was a perfectly baked , flaky, moist mouth watering detour from all the bland , overly sweet scones I've tasted at dozens of bakeries all over northern CA. Santa Barbara, you've got magic in this spot !! Wish I found you on my first day  . 10 stars if they had them to give . My chai tea was perfection as well. Why can't we do this right up North?",2019/5/16 16:16
XbRLquBgOOhL_vRS5WyUew,kw1TUkRwEKP5DNrD567HoQ,IDtLPgUrqorrpqSLdfMhZQ,5,1,1,1,"This is always one of my favorite stops in Santa Barbara on the Funk zone. They have a good breakfast sandwiches as well as baked goods. They're inside dining is pretty cute, you feel like you're in a warehouse with high ceilings. They also have outdoor seating during the pandemic and before so that is also an option.",2021/2/6 19:16
MmNb-X5DaauGMQCkT1QqSQ,2CgLe_T0JLIhEGbg60ThEA,IDtLPgUrqorrpqSLdfMhZQ,4,1,0,1,"Nice industrial stylish spot especially for coffee/tea and a quick breakfast. Go early because the line gets long and unfortunately, they only have one register. You order your food/drinks at the cashier, find a place to sit, grab some games and wait for your order to come (service is quick).聽I couldn't decide between English Breakfast tea or an Americano coffee so I ordered both, my two favorites no shame. For breakfast, I ordered the Lox bagel (keep in mind that it's not on the menu when you get there, but you can definitely order it). It was delicious and the tomato was super fresh, no one likes a mushy tomato. 

This is all around a great place to grab coffee, a quick bite or just stop and enjoy a break. It's a little hidden so once you see the sign for Lark it's right next to it. 

It's safe to say, if you trust my judgment, I'd come back here again! Definitely early in the morning, 8:00 am!",2019/5/31 5:14
H1YIVVP5t4JjzwiyuNS_bw,zbcwfpV2yb11YA7Jv6DZ5Q,IDtLPgUrqorrpqSLdfMhZQ,5,2,0,0,Extremely gourmet & tasty!  I split the chicken biscuit & and green eggs and ham biscuit with my boyfriend and we were both blown- both full of flavors! Yum!!,2020/10/23 16:52
QmmeqTzLuoDDFRIMJdqffQ,fzRP--cz8p05m1Rgyw_X9g,IDtLPgUrqorrpqSLdfMhZQ,4,0,0,0,"I enjoyed my food. I got the green eggs and ham. Would recommend! It was tasty. The only qualm was the line was very long to order food! We could not find seating, and the service was slow understandably because it was very crowded. I would recommend having someone save seats for you. Expect a wait for your food. I was a fun atmosphere and very crowded. Clearly a local favorite and for good reason!

My cousin ordered their French toast. She liked it but it wasn't filling enough. She was still hungry after.

My boyfriend had the bacon, egg and cheddar Sandwhich. He liked it. 

My sister got the Kale and Cesar salad. She liked it and it was a big portion.",2020/1/3 6:51
Vx_wcM_LoBYC80iT7dJUlA,YGhIFccQGRe2kiyfV_uAPw,IDtLPgUrqorrpqSLdfMhZQ,5,0,0,0,"Super cute bakery tucked down a little alleyway, outdoor seating available. The green eggs and ham sandwich on a biscuit was so good and filling! Perfect way to fuel up for the day!",2019/6/18 17:00
b86FlUvK9azS7hR3KSOuNA,MwJiJmWxToBs7jlm8AbhKw,IDtLPgUrqorrpqSLdfMhZQ,5,0,0,0,Oh my goodness this salmon bagel was so good I literally had to stop to write this review before finishing it so I could snap a photo. Yum!,2020/11/10 19:53
OwspRoiswk7AzSIdFK-UDw,2dRbjSC90LB0hX1XvkzwfQ,IDtLPgUrqorrpqSLdfMhZQ,5,0,0,0,"Wow! This is one of those rare places where every single thing I tried was outstanding. My wife and I ordered a few coffees, a few breakfast sandwiches, and a pastry. Each one of these items stood out in its own way. The cinnamon roll was impossibly gooey and had a surprising dash of salt that really intensified its cinnamony flavor. The breakfast sandwiches blended a number of different flavors that complemented one another well. The chicken sandwich was buttery at the same time it was peppery, and sweet while it was salty. For breakfast on the go, this has got to be one of the best places in Santa Barbara.",2021/1/16 18:34
E2qE_nI1l6C0TNhufIWRtw,QtVOwzGQZIp_Nip9RqLAbQ,IDtLPgUrqorrpqSLdfMhZQ,5,1,0,1,"This is such a cute brunch spot!  I care here with a friend and had the Green Eggs and Ham Biscuit Sandwich with Avo instead of ham and it was delicious.  The biscuit was amazing!  My friend had the fresh OJ which was great, too.  I had a latte which was also good!

And then we split the olive oil orange cake which, guess what, was also really good!  It wasn't too orangey - it was moist and delicious - kind of pound cake meets yellow cake but not too sweet.

My only complaint is that the wifi wasn't great and the bar back was reluctant about plugging my laptop in behind the bar. 

It's a great spot to meet friends, have a date, try some wines and get a little work done!

If I'm back in the area, I'd go back!",2019/11/15 8:40
5Omp7u-HUTm0gicURZCZZQ,81L7Jr7kV7CMd2MFP534_Q,IDtLPgUrqorrpqSLdfMhZQ,5,0,0,0,"Tried their breakfast sandwich, bread, peanut butter cookie and iced tea = all delicious! Worth the wait.",2019/2/18 22:25
-5TZ5sIXIsb_p1ZIhrNzJA,5BpJEC8YVi80ecWT5CtlfQ,IDtLPgUrqorrpqSLdfMhZQ,4,4,3,3,"A little bakery that appears to share dining area with the adjacent wine bar, love the warehouse atmosphere

I'm sure their menu is seasonal but we came last summer & figs were in season! 
---fig cheese honey toast with arugula: a bit pricey but it was so so so good! Giving the avocado toast trend a run for its money!!

I'd definitely stop by for a snack again next time I'm in the funk zone",2017/7/29 5:15
b-hGvz9T07ak8Bssc2P_Hg,oVWPoK3yVHNvXYFxJRVSsw,IDtLPgUrqorrpqSLdfMhZQ,5,1,0,0,"So happy we found this little gem. Helena Avenue Bakery is a fairly big space, tall ceilings and plenty of seating inside and outside.

We asked for some recommendations and damn, I'm glad we did. We got a blueberry lemon scone, a croissant and a morning bun. The blueberry lemon scone was the business! The morning bun was so good - not too sweet. And the croissant was light and flakey. Coffee was good as well. Definitely make it a point to check this place out if you're in SB!",2018/10/29 2:35
JY63CHJCbEv9vbxW8b2pjQ,ZwVifRH0AXlUOSfsy0NMvA,IDtLPgUrqorrpqSLdfMhZQ,5,0,0,0,"This place has THE BEST FOOD & SERVICE!!!! The Manager Wyatt Davidson was so nice that we came 2 days in a row. He made us feel special and valued. That's how you want to feel when you go out to eat. Great food, excellent service!!!! Looking forward to coming bk!!!!",2020/7/18 19:26
PSO9tP8BCHaHoNlRomvwhQ,Cc1g_dKDiikAz9H3_1Tyaw,IDtLPgUrqorrpqSLdfMhZQ,5,0,0,0,"Their food is bomblicious, love the cheese burger and the chick sandwich is one of the best I've ever had, bomb dot com!",2019/12/10 21:03
dVKopy7mEXO14NuTKCW3qA,vEpiJpTExbY3t9v3zztUyA,IDtLPgUrqorrpqSLdfMhZQ,5,0,0,0,The Carpenteria Avocato on Sourdough toast is amazin. Nice setting and wonderful food!,2020/8/21 20:22
mG2gYRLFc8V2mVp7X_ZWZw,M7DdrEBlwcI_Kekc4Y_tvA,IDtLPgUrqorrpqSLdfMhZQ,5,0,0,0,"Dyno-Mite!
We picked up some breakfast snacks from Helena Ave. Bakery to bring back to our hotel and were so pleasantly surprised by the amazing food quality, freshness and creativity.

Don't sleep on the Elvis-style banana bread with peppered bacon and peanut butter.  There's enough for left-overs later in the day.

The salmon bagel with pickled onions, fresh dill and cream cheese is perfectly toasted, presented and packed with flavor.

We also loved the green eggs and ham sandwich.  Sky-high fluffy eggs with shaved ham, cheese and green harissa for a spicy/tangy kick.

The coffee was very flavorful as well.

Thank you Helena Ave. Bakery for the great start to our day!",2021/7/31 16:14
x6rgWp0f9vBGYCm7e9tlTQ,hQ2J7jVotw_p6fBT3LPxig,IDtLPgUrqorrpqSLdfMhZQ,5,0,0,0,"This is a great place to get a bit of breakfast and coffee. The bakery has both indoor and outdoor garden seating. Nice atmosphere. Cheerful employees. 

We got a cinnamon roll and the chicken sandwich to share for breakfast, along with a couple of lattes. The cinnamon roll was massive - great for sharing. Lots of good cinnamon. The chicken sandwich comes on a brioche bun, with bacon and a sweet and spicy jam. The chicken is perfectly cooked, crispy and savory outside and juicy inside. I would definitely recommend making this a place to get breakfast while in Santa Barbara.",2021/7/12 16:22
KQKrHfzg3uuhW4AHezGA5A,Ul5B0XkabKJLy3cZ4AW-nQ,IDtLPgUrqorrpqSLdfMhZQ,5,0,0,1,"Stopped in for breakfast.  Super hungry. My cousin and I decided to order a few items and share ""family style."" Our menu = zucchini soup, avocado toast, ricotta toast, potatoes, bacon and a blueberry lemon scone.  All delicious!  Plates are small so if you come here with friends and can't decide what to eat I recommend sharing.  It's a decent amount of food and you don't get stuffed.  Avocado toast..good. Ricotta honey toast...good. Potatoes...good. Cappuccino...good.",2019/10/31 18:41
_aStxZIPGIdmWEHTEU7p4w,3NEHlPS1LGyTMddqMoSyCg,IDtLPgUrqorrpqSLdfMhZQ,5,0,0,0,Just stopped by for pastries for breakfast. Super nice people and very dog friendly. Will definately be back.,2018/8/12 20:55
jOPv4p03Pesghorv3K-sEw,k16ZKDrl1oeQOrnAY0isfw,IDtLPgUrqorrpqSLdfMhZQ,5,0,0,0,"Not your typical breakfast experience. Unique menu options, beautiful presentation, and high quality ingredients. Place you dream of coming back too. On the pricier side. 

Con: wish napkins were more available. Could be uncomfortable waiting with your mouth dirty to ask for them.",2020/6/22 3:54
JuuVAUDio82kjPpPBXNf8g,zOv_lASUx19u5BrsAlt1IQ,IDtLPgUrqorrpqSLdfMhZQ,5,0,0,0,"Best BLT (with Burrata Cheese) I have ever tasted!!
I care a lot about sandwiches, and Helena crushed this one.

Sourdough was magically toasted and did not scrape but kissed the roof of my mouth, with all of the flavors between this beautifully fermented bread singing together in harmony.
Wildly impressed and will be back for more!!",2019/9/4 21:42
5lX48NmoLewZa4VBxP72VQ,zUEp2EvuRXeFl5thO3YtGA,IDtLPgUrqorrpqSLdfMhZQ,5,0,0,0,Came to visit my friend always looking for a new spots to try Helena caught my attention and we came to try... I got the spicy fried chicken very delicious and the chicken was soo crispy on point and the bread so soft and fluffy . The smashed potatoes with the spicy ketchup was good too. This place did not disappoint. Cute spot,2021/12/19 20:25
3kSVGQEWYWXWtxjvV2dCyA,3y9KA46fe6XULOZSOC2tYA,IDtLPgUrqorrpqSLdfMhZQ,4,3,1,1,"Cozy relaxed spot with good coffee. (5/5 green stars)
Plenty of indoor and outdoor shady seating and decent WiFi make this a good place to work. Nice music playing, from Beach House to Grizzly Bear. Great coffee - no pour-overs, but their drip coffee tasted fresh. It's from the Dart Coffee Co. (new to me) - lightly roasted Peruvian beans. Decent value too - I had a coffee, bagel with cream cheese and tomato, and muffin for about $9. Coffee refills are free, so I had a blueberry scone ($4) to go with the second cup ;) I have mixed feelings about their pastries. They all look good, and while the bagel tasted good, the muffin and scone were bland and both were a touch overdone. The muffin was listed as grapefruit poppy seed, and while the texture was good, there was no grapefruit flavor that I could detect. It was a Monday - perhaps an off-day?  Would recommend it for the coffee and ambiance, and I think the bakery side has potential - their baguette sandwiches look great.

I'm also giving Helena Avenue Bakery 5/5 ""green stars"" for social and environmental impact, based on these reasons:
* Their coffee, from Dart, is certified fair trade and organic. 
* They use organic flour for baking, sourced from Central Milling
* They have ceramic cups and plates and metal utensils for eating in-house.
* Items like sandwiches have just a simple paper wrap.
* Even items that come in packaging (like house-made pickles) they have made fairly sustainable choices (cardboard and PET). 
* Cold drinks cups are compostable, although hot cups and lids are not. 
* Water is available in little glass jars. 
* The support some local charities and events such as bike to work day and Heal the Oceans. 

Find out more about green-star ratings at Green Stars Project dot org. 

PS: The address is a bit confusing: if you approach from Anacapa Street, make your way past The Lark and you'll find this bakery next to the SB Wine Collective. They share the same space (so you can have wine with your bagel instead of coffee, if you so wish). It's easier to find if you approach from Helena Avenue.",2017/7/25 21:14
TO39QYYPxpE62hxWyfBilQ,BDau_iA9Zh0iWpH6BOyGVA,IDtLPgUrqorrpqSLdfMhZQ,5,0,0,0,"Great ingredients, unique flavors and the kids even enjoyed the honey ricotta toast! 
Worth checking out!",2019/11/3 15:45
zbrYFp3FNc1FNovlPmxfbQ,FcWu03iLuGYGHbFXO556pA,IDtLPgUrqorrpqSLdfMhZQ,5,1,1,1,"Best iced vanilla latte I've had in my life. Friend ordered their biscuit sandwich and donuts and said it was the bomb, it looked amazeeeee. Would rate five stars alone just for the latte. 

Worth the price. Plus it's very cute and industrial-chic on the inside for all the trendy peeps.",2017/9/3 17:55
MvkzsY6BH6Fb5AABgLyAhg,SsgDGJWBNvefjY0z8XsVCQ,IDtLPgUrqorrpqSLdfMhZQ,5,5,4,5,"Helena Avenue Bakery is a must-visit for those looking for a great breakfast place in Santa Barbara. Not only is it in Downtown Santa Barbara, but it is located in the trendy FUNK ZONE close to the wharf. Really, you could start your day here and walk to a whole lot of points of interest from here.

The egg, ham and cheese in a biscuit breakfast sandwich is so hearty and filling that you could split it into two, if you like light breakfasts, and be good to walk around for several hours after.

The biscuit is so buttery and flaky. The pesto sauce was so good. The cheddar was sharp.

The heirloom tomato galette, though not as heavy in the tummy is still large and filling.

They also serve very good espresso coffees and teas.

Outdoor dining was available - when it was allowed. Masks are required.

Street parking is plentiful in the morning, not so much in the afternoon.

Helena Avenue Bakery shares their space with a wine tasting shop. So the space is a bakery in the morning and a wine tasting shop at night. Great concept!

Also, there is a doggie bowl of water provided for your four-legged friends/kids.

I really wish I had the opportunity to go again during my trip here. When I come back to SB, I will sure try to come early so I can have breakfast here.",2020/12/27 23:41
9z8IrcxNTm1J-mGEZzYTYQ,hu53X0AgSKMt8UuHjp5ZLw,IDtLPgUrqorrpqSLdfMhZQ,4,9,1,6,"Every single thing I have had here I have loved! The churro donut, pesto asparagus salad, chocolate zucchini bread, peanut brittle cookie, chocolate chunk cookie, espresso, and so on. My all time favorite is probably the chocolate zucchini bread as it is so dense and flavorful while also tasting fresh and light on the digestive tract. The chocolate chunk cookie is a close second.

I haven't had many savory options here as they are pretty darn pricey for the portion size, however the couple I have had have been mighty tasty, fresh, and packed with the perfect combo of flavors. So in a sense, yes it's expensive but you are really getting what you pay for. They have many breakfast options that are served until 11 am then the lunch baguettes and side salads take over. 

Personally, I'd recommend this spot if you are looking for an artisanal breakfast with craft coffee and quality foods and/or sweets. It's also a nice spot for those wine tasting in the funk zone and want a little snack-a-roo between tasting rooms without walking too far and/or eating too much. 

Food is tasty, staff are kind, and the environment is adorable - The only downside to this spot for me is the prices. It would be a full 5 stars in my opinion if things were just a little more affordable. I'd also enjoy if they had a little more lunch options that didn't include so much bread in them or paying $10 for a few bites of delicious greens instead. Wraps would be awesome! Overall though, tourists especially, definitely check out this bakery at least once and try a quality baked good!",2017/8/11 18:21
_x98IrVXMEZYw09W4HCEVw,L_AkIHG-wVqb1DkswR0aPA,IDtLPgUrqorrpqSLdfMhZQ,5,0,0,0,Absolute delight from the atmosphere to the divine food. Very welcoming of dogs and very good service.,2021/4/8 17:58
a7x_wDd-1BqM_l9coEgM7Q,QLLyNkueps6i-WD-Ht5J-w,IDtLPgUrqorrpqSLdfMhZQ,5,2,0,2,"On our way to SLO we were starving so of course I went on Yelp to find our first stop on our adventure. So glad that we stopped here! Walked in and found a nice open space with plenty of pastry options to please anyone, plus a few breakfast options. Well, let me tell you, nothing here disappointed. The person taking our order was patient and helpful and the blueberry lemon scone and fresh squeezed OJ was the perfect beginning. Then we got our breakfast sandwiches and boy oh boy were they top notch! The biscuits were so fresh and the flavors blended perfectly together. If you get the chance stop by and grab a pastry to go and/or have a breakfast sandwich that is filing, but doesn't make you feel stuffed!",2019/8/15 15:58
VHTUcEyCa5X0dr-8olO9eg,4RouQSPWzvNfzh9t-9eUTA,IDtLPgUrqorrpqSLdfMhZQ,4,0,0,0,While taking a morning bike ride along the beach and into town we stumbled on this super chill spot. Was great for a lazy breakfasting morning with my best girl friend and enjoy the slow morning start with good coffee and excellent food.,2021/6/22 16:43
tYD4ckaB8JAqT6Rtto-hgw,f_g2_8JxQ3XuITxswPn2HQ,IDtLPgUrqorrpqSLdfMhZQ,5,0,0,0,Delish!!! Worth every calorie!! Can't wait to go back. We had multiple Items and the coffee was great.,2021/4/6 4:22
dK1hA-BJvzv6nSP4PsRybQ,PA7wh5pQK6NuqlxTGXyvYA,IDtLPgUrqorrpqSLdfMhZQ,5,0,0,0,I have been here twice...once to carry out some of their fresh bread for a friend's wedding and once for a scone with a dear friend going through a break up. The bread was delicious and the scone wasn't dry like a lot of scones I have tried.  The counter help was cheerful. I want to go back and try more items on the menu. The whole area makes you want to go back...,2020/1/4 16:46
FNlYrAeg0HkrlffI6LaWgw,7jIqY6egMZnAxNOOFTMQZw,IDtLPgUrqorrpqSLdfMhZQ,5,0,0,0,Not only is the food delicious but the staff is super friendly and the place itself is stunning the way they have the bakery on one side and the wine bar on the other. Wish I lived in Santa Barbara so I could enjoy it more often. Will be back! And thank you to the employee who sent back my hand brace that I left by mistake. Cheers!,2018/12/4 4:38
IKCORaZ-yl4yeLHiSjusOA,XI0qu2TFtpheILYvXbwXng,IDtLPgUrqorrpqSLdfMhZQ,4,0,0,0,"Food was delicious, could've used just a little more given the total price but not exceptionally expensive. Service was also very friendly, seemed to cater to more locals than tourists at the time which was refreshing.",2019/9/27 1:34
MCSJTT2Z7t1vWwUd2uWz_Q,arSv7KezjzyhOuP4uCqoAQ,IDtLPgUrqorrpqSLdfMhZQ,5,0,0,0,A great little spot for some coffee and treats! Small outdoor area but quaint. Inside decor is rustic and done very well. The family and I shared an avocado toast and a sticky bun and both were fantastic! We will be coming back and trying the Huevos Rancheros next.,2019/7/5 16:24
PXh5WCQNQsBMLweyNyPwgw,bScgvXrGLijfxt_ygFGNpQ,IDtLPgUrqorrpqSLdfMhZQ,5,0,0,0,Kaylee? Kailey? Kayleigh? Might still have the spelling wrong but this girl is super woman! As someone in the restaurant field I would hire her in a second for her above and beyond hospitality. I missed their hours after driving up from Santa Monica so didn't get anything but my savior was there with a warm and comforting approach that left me excited to come back. She even tossed me a baguette for my troubles and gave me directions to a great spot around the corner. A raise is in order and kudos for Helena for having a great staff and amazing looking set up.,2020/11/20 1:22
DYHmkd0GJ4MRxb0p0Q2Azg,s_f4ZXnzZgesLOPLPzj2aA,IDtLPgUrqorrpqSLdfMhZQ,5,0,0,0,"Great vibes, friendly people, casual, and amazing breads and breakfast... what more could you ask for? Enjoyed two different toast items and some coffee. Great atmosphere and everything was so fresh and carefully prepared. The ricotta and honey toast is kinda next level. Also got a few loaves to go of their incredible artisan break. A great place for a mid morning casual breakfast.",2018/11/4 0:25
G6Ov8_CIBrs9Mi1afQf32Q,Zod5ztSNDhjSuwt7d2nRBA,IDtLPgUrqorrpqSLdfMhZQ,5,0,0,0,"This place is an absolute home run! Have you ever imagined putting banana bread with bacon, peanut butter, bananas and maple syrup? Well, these guys have and DID! It's out of this world delicious! The avocado toast was amazing to the last bite. My husband had the bowl and added an extra egg. He explained that he's happily eat that every day for breakfast",2020/11/11 22:55
