review_id,user_id,business_id,stars,useful,funny,cool,text,date
EtRmv8HXILJW_JDK1F-GrQ,m7UWzGjiqXID8SfFWWzYzg,IDtLPgUrqorrpqSLdfMhZQ,4,0,0,0,"Overall, I enjoyed Helena Avenue Bakery.  The atmosphere was great, and it was fun to watch the bakers make the bagels and other food through the large window.  I ordered the bacon, cheddar, and egg biscuit.  I was hoping it would be flavorful, but it was pretty bland.",2019/3/19 15:47
nB44Q2SQGWOxr5I8D_reVQ,0bB97VkdPlPhvajCTffgIQ,IDtLPgUrqorrpqSLdfMhZQ,4,0,0,0,"This place has a good selection of breakfast items. I stop by sometimes on my dog walk loop. The green eggs and ham sandwich is amazing. Pesto pairs nicely with everything on it but the best part of their sandwiches is the delicious biscuit it comes on. I also recommend the fried chicken sandwich. It can be kind of greasy but that helps hangovers (or so I've convinced myself). If you like a little kick in the morning, go for it! (Ask for extra napkins). Would give five stars but I got the impression the restaurant isn't as dog-friendly as other places around town.",2021/2/5 22:32
UEe1alEcPNaV-KovqJjxOA,wocdHbgYu0zTgECrxi_QVA,IDtLPgUrqorrpqSLdfMhZQ,4,0,0,0,"Formerly I gave 5 stars.  Food & staff are 5 stars! I tried the cinnamon bun, take-out today.  Couldn't taste the cinnamon, bland tasting, pricey! I couldn't eat it...threw it out. Bummer as it wasn't inexpensive! Everything else I've tried is delicious. Hopefully I'll hear back from management!",2021/10/4 0:43
iU7X7eWs76BPlBovvKBdfA,Py1CYjgdkfBC23AaMpsvRA,IDtLPgUrqorrpqSLdfMhZQ,5,0,0,0,Had a pretty amazing breakfast experience here last week. We had one of their breakfast sandwich on brioche which came with a thick square slab of egg which looked pretty cool and a breakfast bowl which was pretty tasty. The patio had a nice ambience and the area where it's located is pretty hip.  Will definitely return again when I'm in the area - wished we could have had breakfast there every morning.,2021/4/30 16:40
BHsAgG5yQZY4413NtmR8Iw,PvpabHP_uxTwUC1n96JiMQ,IDtLPgUrqorrpqSLdfMhZQ,5,4,1,3,"We needed a quick bite before meeting up with friends, and Helena was walking distance from our Waterman Hotel.  My Americano was a great pick me up, hot and smooth.  I got the biscuit with lavender jam and butter.  The butter and jam taste a bit sour and unfortunately the biscuit was cold and dry. I did not know this til we were eating it down at the beach.  

But - the life saver was definitely the breakfast sandwich in a soft brioche bun.  It has the thickest and fluffiest baked egg in the middle with 
a big slice of bacon. It was simply delicious! They also had a other pastries and sandwiches we wanted to try however just not enough time to come back with our friends' weekend destination wedding.  But to our happy surprise the newly bride and groom catered from Helena for our weekend farewell brunch. We got to try everything else and more!  The chicken sandwich, the Elvis style banana bread, the avocado toast, and the cinnamon roll. The cinnamon rolls was bit thick and dense, but everything else was delicious! Whoa, a breakfast at Helen's will keep your stomach very happy for sure!",2021/9/26 2:26
WDmDUV44XH6d168D_Pxwbw,e0eSpD5TJzQJwWYHJNdgfQ,IDtLPgUrqorrpqSLdfMhZQ,5,0,0,0,The coffee and pastries are excellent. The staff is friendly. The location is very clean. Great decor. The only down side is parking is limited in the area.,2019/4/28 2:04
zlHN-JCdIcIPncgj5S8x7g,2mA7x9Ytdjtf-ux7-RCVHQ,IDtLPgUrqorrpqSLdfMhZQ,5,0,0,0,"The best breakfast in Santa Barbara. The bacon is perfect, the breakfast sandwiches were gourmet with carefully crafted ingredients that explode in your mouth. The biscuits are enormous with homemade lavender jam. We came for breakfast two days in a row because it was so good! The staff was so friendly and helpful.",2020/8/30 14:36
kuM0mXP_8qKruork6V5ZXw,SaPzCI-Y0_aQgXWPRefvFw,IDtLPgUrqorrpqSLdfMhZQ,5,0,0,0,Nailed it. Great breakfast spot and super cute. I loved our visit here. Everything was taste. I want to come back again and try the other things on the menu.,2021/5/11 18:35
BuhI6lwta5Lm4w3Rx2REew,oCNcyV-Ol2b6Z1xd8gXDRQ,IDtLPgUrqorrpqSLdfMhZQ,4,0,0,2,"I love its atmosphere! It was stylish. I had a cup of ice moca and one chocolate croissant, which were delicious! I sat near the outside, but it was nice temperature, so I could focus on my task. I wanna try different dish next time. One thing I wanna demand is I wanna it to clean the desks up because crumb of left tends to be left them.",2017/8/31 0:14
191jsenuk79ZoV7p-wxoEw,vMAn7Ahy7Vy9Z_N3ilNj7g,IDtLPgUrqorrpqSLdfMhZQ,5,0,0,0,A jewel of a cafe and bakery we found on our last day. Definitely seemed popular with the locals which we try to find whenever we travel. The morning bun was tasty and crispy and the coffee was good. Neat space too.,2019/3/3 1:24
PRQfv2CSfH7PaPdU-QWvUg,_cSYZ6-zQPDpzBg7CGkgug,IDtLPgUrqorrpqSLdfMhZQ,5,0,0,0,"Super cute bakery and breakfast spot in the funk town district of SB. They have a super open indoor area as well as a great patio area with outdoor seating. Their pastries all looked amazing but we went with the blueberry lemon scone (cinnamon roll was a close contender) to start and it was up there with the best scones I've ever had. There were actual blueberries inside and it was fluffy with a hard outside, 5/5. For our meals I got the yogurt bowl with blueberries and their homemade granola which I was a huge fan of! It was also a pretty hearty bowl so was filling. My friend got the avocado toast which was also delicious, fluffy bread with feta cheese and a good portion of avocado. Overall, great ambiance and loved all the food we tried!",2021/7/3 1:13
Mqh2anPpP_vvLtqCAk_1Xw,x1ZeQbGxfTPZ2BM0VcWs9w,IDtLPgUrqorrpqSLdfMhZQ,5,7,2,5,"If you're a tourist and spending the weekend in Santa Barbara, I'd recommend to give this place a go for sure. If you're a local, then not so much. This place falls under the bracket of expensive but great quality. We ordered an avocado toast, a salad bowl and mocha, all of which were pretty good but a tad too expensive for our liking. We still had a wonderful time primarily due to ample seating, great service and the ability to find a parking spot in close vicinity",2020/2/18 0:50
RUUUfu9qsPOr19WviEu4Wg,5NI-VGNUxa7XN_W3n3hxBg,IDtLPgUrqorrpqSLdfMhZQ,5,0,0,0,"We were not able to get in on a Saturday or Sunday... So I'm only giving the review based on the people in line, of which there were many. We will try it again when there's less crowded probably during the week. I love the setting and look forward to eating there sometime soon. The ambience is fantastic. Look forward to eating there next trip.",2021/10/10 21:44
XkCJyYSiFVYi8sDR5RbLjA,mLJyoSdJRHXEoBHjAbIJJQ,IDtLPgUrqorrpqSLdfMhZQ,5,0,0,0,"delicious! came on new year's day and they were very busy but the food was outstanding, friendly staff and great atmosphere.",2020/2/8 18:53
#NAME?,i3tYR78tEIcAzeynP7Bu0A,IDtLPgUrqorrpqSLdfMhZQ,5,0,0,0,"Tasty food with fast, friendly service.  I tried the french toast for the first time this morning and it is no doubt THE BEST french toast I've ever had.  The deli salads are fresh and yummy.  How do they make the veggie sandwich so delicious???  The gluten free muffins with almond milk latte are a part of my daily ritual.  Its a classic, traditional bakery but you can get healthy, veggie & gluten free options if you ask for them.",2017/3/18 19:37
JjK6P22Mi1tcJl_aKRuP9A,bvHhVoVJcua2Ks2P8BW4PA,IDtLPgUrqorrpqSLdfMhZQ,4,0,0,0,"Nice place for breakfast, good variety of food. One thing which was a bit strange - cutleries were not properly washed, I tried several before I found a clean one.",2019/8/23 18:36
P2tBCNxHKMKeN9DUlh7zUQ,UxKp9fHl6DjYRKWyfZ3Xhw,IDtLPgUrqorrpqSLdfMhZQ,5,0,0,0,"We had the fried chicken biscuit with jalapeno jelly, which was fantastic.  The jelly packed a nice kick to complement the chicken and biscuit. Also, the peppered bacon was thick and flavorful. The BLT was excellent with a great piece of break. Finally, the french toast was good and sweet. If you want to control the sweetness, just ask for the syrup on the side.",2020/11/15 16:01
sumvD94l5WFFqFl7uQshWg,4_62d9Lkw7pK9zbb3xFxyQ,IDtLPgUrqorrpqSLdfMhZQ,5,1,0,1,"You will be impressed with everything created by this bakery. Pastries. Coffee. Breakfast. Lunch. Desserts. Breads. 

Here you'll find the expected with special touches (salted brown butter cinnamon roll) as well as creative offerings (Elvis style banana bread.) Breakfast or lunch, the sandwiches are excellent too. And don't leave without a loaf to-go; we're partial to the sourdough or cherry and pistachio, which has the same sourdough base. 

Don't hesitate, just go; open daily 8 to 2. 

The Helena Avenue Bakery is reason alone to move to Santa Barbara.",2021/1/25 20:35
kJuMf4mHUHVhqdfBt2Cn2w,HPyZ_STe3lsXdP3guAUzOg,IDtLPgUrqorrpqSLdfMhZQ,4,1,0,2,"Went to Helena Avenue Bakery during a visit to Santa Barbara.  Heard from all the Yelpers that this is a great breakfast spot and they were correct.  

They have outside sitting and were constantly cleaning tables, which made my party feel very safe.  

For breakfast, we had the privilege to try the Breakfast Sandwich on Brioche and the Fried Chicken Sandwich (new on the menu).  We also had the Savory Galette.  The sandwiches were very tasty and great for breakfast.  The Savory Galette had tomato and cheese inside and hit the spot.  We also had an Americano and Matcha Latte with Oat Milk.  

Overall, great breakfast spot and would love to come back again",2020/10/8 22:32
9k3FcH5aaaOXSfEhacNbpg,SQvbysJ2SUVTLPfzDdVadg,IDtLPgUrqorrpqSLdfMhZQ,5,0,0,0,"I really love this place. When we were in California earlier this month, we drove 90 min out of our way to eat here because we loved it so much the last time we were in Santa Barbara. A lovely place, great bakery and coffee, lovely food, friendly staff - one of my favorites. You should check it out.",2021/8/27 17:07
98-0aWW-pjbUGRl-jCx3Bg,riLA6RffXpgBh0ZQPTKJ4g,IDtLPgUrqorrpqSLdfMhZQ,5,0,0,0,good coffee and even better food! both toasts were delicious. recommend the breakfast sandwich and the potatoes for something savory. the bakery is gorgeous and the vibes are great. need to show up earlier next time to get a cinnamon roll!,2021/7/8 16:31
4lySOQaI5zUPSu1SmbnOSQ,j6_CkcxXI6oZHN3BZFVHrg,IDtLPgUrqorrpqSLdfMhZQ,5,0,0,0,Amazing food. Fried chicken and bacon biscuit sandwich is out of the world. Full of Flavors,2020/11/15 18:45
wKQynzrtE8gDd5wXG-nulA,pB5HpkuoVXvWvulS3rm4Pw,IDtLPgUrqorrpqSLdfMhZQ,5,0,0,0,Food and coffee were excellent. Service was top notch. Would highly recommend to friends.,2020/8/24 17:11
FFfFL_NP9U7Z5FXIxyGU_w,wVhd99Kl7mIxVMQ_8L210g,IDtLPgUrqorrpqSLdfMhZQ,4,29,15,23,"So the address is 131 Anacapa, but technically the bakery is closer to another street... Helena Avenue, whaddayaknow? If you see a restaurant called The Lark, keep walking past the patio seating until you see the Santa Barbara Wine Collective. Entrance is the same (same owner actually), and you will see some signs and bread on display. 

On the menu you will find baked goods, pies, drinks, artisan bread, and a limited amount of food items. Breakfast is served all day, they make a great brioche breakfast sandwich and smoked salmon bagel. Lunch starts at 11AM, you can choose from a couple sourdough sandwiches, a cheeseboard, or 
Tuscan Kale Caesar Salad. Their menu is not as extensive compared to other places, but quality over quantity. 

Before you roll your eyes, their rendition of avocado toast was pretty unique and had a couple ingredients not normally added. The sourdough was toasted a bit too long, it was hard to knife through the charred edges. On top you have a delicious spread of Carpinteria organic avocados that held everything together. Slices of cucumber (could do without), a couple of sprouts (gross), and some feta (yummy) are included. For flavor, they add a sprinkle of pepper and sunflower seeds. I also got an egg for $2. Maybe too much fluff that didn't need to be there, but a good dish nonetheless. Went well with the iced vanilla latte I ordered. 

Wonderful space to hang out for brunch (when allowed).",2021/1/19 7:09
JsSqL_sGzON_T8gwRpW8aA,II5au_6a_MTkiSP-O6t15Q,IDtLPgUrqorrpqSLdfMhZQ,5,0,0,0,"This place is great! I went here on a Sunday morning and luckily beat the rush. The line got pretty long after we ordered our food. You order at the counter and find your own table. There are plenty of tables outside on the patio and inside. I had the breakfast sandwhich on brioche. It was so good and filling. I loved that the egg was thick but still soft. We also got a biscuit breakfast sandwich. The biscuit was even better than the brioche! It was tender, flaky and peppery. The pepper was unique and made it extra good. The coffee was pretty good too! I'd love to go back and try some of their other baked goods and lunch items.",2021/11/18 18:00
DqSTQTNrW2zLckTkQs-DlA,2kl_zaWDKIgbpqvPJN1zVA,IDtLPgUrqorrpqSLdfMhZQ,5,0,0,0,Soooo yummy!! My bf and I ordered the avocado toast with an egg and the green eggs&ham with a biscuit. I wish the egg would've been cut more on the avocado toast but other than that it was cooked perfectly and looked very visually appealing. The avocado was so creamy and the cucumbers were cut with finesse and it was all seasoned perfectly! We also ordered two mimosas which tasted delicious. They also have wine and I really wish I could have ordered the strawberry toast. Will definitely be coming back,2021/9/27 22:25
Kal5Dh2JHWziqrwvuR7Gjg,ZDeSEn0ikukDWMy0rXTOnA,IDtLPgUrqorrpqSLdfMhZQ,4,0,0,0,"This place is a gem! They have a beautiful outside patio and spacious seating inside as well. Love the industrial look that they worked with.

It seems to be a popular spot, when we arrived, there was a line to order. The wait time after, however, was pretty fast. 

We ordered the warm brown butter cinnamon roll and the breakfast sandwich on brioche. Each one was plentiful for us to share. 

The cinnamon roll was so good! It was soft and well balanced in its sweetness. We wished it would've been warmer, when we got it it wasn't as hot as we would've liked.

The breakfast sandwich on brioche is pretty big! I really like the flavors, my one complaint is the egg patty is pretty thick and sometimes that's all I would taste.

We got drip coffee to wash it all down. Unfortunately, the coffee wouldn't be the reason why I would go back. I'd skip the coffee and get another drink.",2021/12/25 0:00
e5QwUm_5DgAr8C7g8DPh-Q,gQxcMEFRAG5oHdASfdk-MQ,IDtLPgUrqorrpqSLdfMhZQ,5,0,0,1,"Such a fun brunch spot! 

There was a DJ which gave this place a great vibe, I see why they call it the funk zone!

The food was also amazing, we spit the turkey sandwich and breakfast bowl and they were both delicious. The turkey sandwich was perfectly spicy from their special sauce. 

We also all split the strawberry toast which was AMAZING!",2021/4/8 2:39
SPFXoCu4x9oliMzWpUv_Yg,WUQnlbpemw1qOVeLMToWKg,IDtLPgUrqorrpqSLdfMhZQ,4,3,1,3,"Stumbled on Helena Avenue Bakery after searching for a quick lunch to take on the road.

Southern Fried Chicken on brioche (sandwich): this fried chicken sandwich was one of the most unique ones I have ever eaten, if only it was executed properly.. 
The good: brioche (golden and good crumb, grilled so it was toasty); jalape帽o jam (sweet with a nice kick); black pepper bacon (peppery as advertised and extremely crispy)
The ""bad"": the chicken was incredibly crunchy and chicken well seasoned, but unfortunately a bit dry and burnt on some ends. 

I'd still recommend the chicken sandwich but I'd hope this was just an off day and that they don't aways serve burnt fried chicken because all of the other components of the sandwich were fantastic. Another gripe I have is that I ordered 3 spicy versions of the sandwich and none of them were spicy. Didn't go back because we were already on the freeway. 

FYI: There's public parking (structure) available within walking distance to the bakery. Check out the photos for the entrance and fried chicken sandwich",2021/12/30 1:34
BhG07an5-_fbjYdvSCamcA,14geaf8eD7bmX1c0gzx65A,IDtLPgUrqorrpqSLdfMhZQ,4,3,0,1,"Stopped in with a friend for a bite to eat and some wine/mimosas and coffee. We got the Sauvignon blanc and a mimosa and both were good. In terms of food, we ordered the avocado toast and the green eggs and ham. Everything was very tasty. We also got some cortados with almond milk which was well made. Overall, this place is great and will return again.",2019/9/23 4:13
Vi2XCnR4slU3R45TY5EZkA,LM1Aleq_ozhEslRd2GUGEQ,IDtLPgUrqorrpqSLdfMhZQ,5,4,1,4,"Went for our usual morning walk and decided to try something new today, have breakfast in the funk zone. Found a great place. No one there when we arrived and they have a very open environment with great spaced outdoor seating. Thank goodness for the great spaced outdoor seating because the place quickly filled up as we were enjoying our breakfast so we quickly exited as I am not into being around lots of people these days. Great service, great food. I had the avocado toast and added the 7 minute egg, it was delicious; just a little disappointed that the egg was refrigerator cold , a warm poached egg would have been so much better.  Hubby had brioche breakfast sandwich that he throughly enjoyed. If you enjoy chew worthy wonderful flavor sourdough bread this is the place.",2020/12/3 2:46
5B0Er5VswiZQsopwH3Xq1A,wocdHbgYu0zTgECrxi_QVA,IDtLPgUrqorrpqSLdfMhZQ,5,0,0,0,Great food! Great people who work there! I'm hooked! Love the vibe...in the funk zone.,2021/1/3 1:00
kCVlWORvq9b0oc5QtMVXvg,Yr5O1eB7XfmerDjccEbwcw,IDtLPgUrqorrpqSLdfMhZQ,5,6,2,3,"This was by far one of the best brunches I've had in a long time.

First of all, the VIBES were amazing. There was a live DJ and it was just such a good ambience. The music was chill and funky, I totally understand why they call it the Funk Zone. 

The patio area was also just beautiful to look at. I loved everything about it.

The food was also super super delicious. I shared the SB Farmers Market Bowl and the turkey sandwich with a friend. The bowl was the absolute star of the show (see my picture). I'm not even a big healthy food person, but this bowl was out of this world. The mushrooms were the best part for sure. SO flavorful.

We all shared the ricotta sourdough toast with strawberries for dessert and everyone LOVED it. 

Can't wait to go back!",2021/4/2 0:54
HH6ESiaDY7GuHs2UkJKS8w,B-lXU55kCpixY-TRZ-XHCg,IDtLPgUrqorrpqSLdfMhZQ,5,1,0,0,This coffee shop is delicious! I'm a simple type of person  in terms of coffee I love drip coffee and their drip is delicious bold and rich  we had the Elvis toast and the Farmer's Market Special both 100% recommend,2021/3/17 19:08
9Rz1tsc1OxnFfIf5k0iiXw,VXOKLeCQ3yt9JqKYbfzVKw,IDtLPgUrqorrpqSLdfMhZQ,5,0,0,0,"Elvis toast was delicious 
Avocado toast was really good too
Baguette was fresh and crunchy on the outside. 
Espresso was a strong and a great pick me up
Yogurt/pecan- phenomenal 

Definitely try Helena!",2021/1/3 18:38
BsQyeUiqU4tubENfQf_Hjg,UZvk5GxtlzORMk7X4x2dUg,IDtLPgUrqorrpqSLdfMhZQ,5,2,2,2,"I've been here a few times over the past few years just for the green eggs & ham breakfast sandwich(it used to be smaller and came with a biscuit). It's my favorite breakfast sandwich. Well...this time around I noticed it stopped coming with biscuits so I replaced the brioche with the biscuit expecting it to be the same size it used to be but I realized they packed the sandwiches in these cute cardboard containers instead of sandwich paper. We got to the car and took out the green eggs & ham sandwich, it was super hefty and ginormous! It was literally the size of a burger! This is one of the biggest breakfast sandwich I've ever had, I barely finished it...now it's making me want to go back to sleep as I write this review. This sandwich is probably going to keep me full until dinner. The biscuit was slightly crunchy on the outside but soft and fluffy at the same time. The flavor is always consistent and I really like the green harissa sauce so I always ask for extra. The egg patty was soft but not to the point where it comes apart, it is the main reason why this sandwich is big. All in all when I'm craving a breakfast sandwich I will always come back here.",2021/11/17 18:29
oNrtJ62g30Xdj_5Ir3_9hw,DrqazmWz4F8LFhTHKhp5oQ,IDtLPgUrqorrpqSLdfMhZQ,5,3,0,0,"WooooooOOooOoOwwwww.. I am in heaven....hands down, best chicken sandwich ever!!! Most places mess up on their chicken sandwiches because they put all the unnecessary sauces on it and the batter to the fried chicken isn't crispy, or no flavor or too much batter, and the chicken is dry. This chicken is juicy, tender, perfect batter where it's the perfect light airy crunch! No sauce sauce is on it, not needed. Fried bacon on top of the fried chicken and the jalape帽o jam sauce (very light) with the brioche bun, is all the flavor it needs!! Bacon is nice and thick. It's not being engulfed with sauce hiding all the imperfection, because it's perfect! The buns is so light and fluffy with the perfect sweetness. 

The challah French toast- perfect sweetness with the honey and the grapefruit is spectacular!!! It's juicy and crunchy. The bread is soooo soft and fluffy. 

Both items were perfectly balanced being able to taste and feel every single flavor and texture. Who created this!? Who are the chefs!? Props!! My new fave spot when I visit Santa Barbara!! 

Staff was very nice and I could see they were all working very hard.",2021/3/13 18:11
OYECcizQXxMP6J_L5n-lLg,NPEnK5_uzLwMb-TncczXhw,IDtLPgUrqorrpqSLdfMhZQ,5,1,0,2,"I got their green eggs and ham sandwich, blueberry lemon scone and cinnamon roll. All were a 10:10 and it's the cutest shot ever! Love this place!",2020/11/27 22:46
GjvQ3MJZl_t08AGCD-Sxfw,hj6bHxcTRCPVhanRL5neGA,IDtLPgUrqorrpqSLdfMhZQ,4,6,1,2,"Shout out to Sierra who has been with Helena for some time.  She always has a smile (or smiling eyes)

Plants based bowl option is good with mushrooms, saut茅ed Swiss chard and fresh raw spinach.  It needs a touch of something maybe small halved tomatoes or slivers of marinated red bell peppers.   Please know if you are vegan you can sub eggs for avocado but watch how they ring you up.  The Lovely gal timing me up added $3 for avocado  but she fixed it when I pointed it out as a sub.   

Why not five stars:  $1 extra for non dairy milk option.  To many places have up charges for lactose intolerant folks.  Note: Old town Goleta does NOT upcharge for healthy plant based non dairy milks. 

Also love to see plant based breakfast sandwich please.  Plant based sausage option for on top of the green bowl or as a side.  There are so many great ones now available",2021/5/3 21:43
7b9AFgF0Ia0K6f-q21A1bw,1nOFMKkjFXi2ri-C9LXBHA,IDtLPgUrqorrpqSLdfMhZQ,5,1,0,1,"When visiting Santa Barbara, this place had by far one of the best avocado toasts I have had for brunch in a while! The portion was great and the feta, cucumbers with the egg all tasted divine! I absolutely loved the vibes of the place with their live DJ playing some funky beats. Along with our avocado toast, we ordered the Farmer's Market Sandwich on Brioche which came with a thick baked square size farm egg that was pretty great - I loved the cool concept that this sandwich had going on. 

To pair with our food, we got a cappuccino to share that was more on the strong side. However, the coffee went well with the banana bread we ordered as dessert which was wonderfully warmed and as delicious. Unfortunately, the last cinnamon roll sold out when we were about to get one ourselves. I will definitely have to return to have a shot at getting a cinnamon roll to try. I highly recommend the avocado toast and the cool thick egg they have inside the sandwich. Lovely place for brunch!",2021/5/23 19:39
8ICoEBSWhY47ZeH1DZ0dXQ,iJQtNnEcrxdpaD132v26nQ,IDtLPgUrqorrpqSLdfMhZQ,5,8,3,8,"Egg & Cheese Biscuit Sandwich! Get it! The biscuit might be the best biscuit I've tasted. Fluffy, doughy inside, crisp, glaze outside. There has to be some browned butter or grass fed butter involved. So good! The egg is served slightly runny and it's creamy yolk is the perfect compliment to the tomato jam. Heavenly! 

If you want a grown up take on the classic McDonald's Sausage Biscuit. Walk over to Rebar Coffee and Kitchen across the street, order a side of their house made (amazing) sausage patty, then head over to Helena Avenue Bakery and order the Egg & Cheese Biscuit Sandwich. Once you get your sandwich, pry it open, careful not to mess up it's yummy contents and place your Rebar sausage patty inside. Re-wrap and voila!...You have an incredible gourmet, adult take on a childhood favorite! 

I also highly recommend any of their quiches. The crust is legendary! 

Great customer service. Order at the counter and wait for them to call your name or number. Self-serve water, napkins and utensils. Plenty of seating amongst the long farm-style tables and chairs.

I'm really happy to witness the evolution of Helena Avenue Bakery. It started out small, with a very limited menu. Now it is bustling! I love the addition of the glass wall giving eyes to the exhibition bakery. I am excited to try their fresh baked loaves and rolls. It's great to have a local bakery so close to home!",2017/4/22 15:12
0XpXV0fT-daXJJUdz6UROQ,Hz9Xek6Dx-5wWN71UO7lSg,IDtLPgUrqorrpqSLdfMhZQ,5,0,0,0,"Excellent Brunch Spot
Gluten-Free Biscuit Option
Be Prepared to Wait during Busy Times",2021/6/22 22:12
